{
  "$schema": "../language.schema.json",
  "version": 1,
  "id": "de",
  "locale": "de-DE",
  "name": "German",
  "nativeName": "Deutsch",
  "messages": {
    "Starting": "Start",
    "Project": "Projekt",
    "Workflow sections": "Workflow-Bereiche",
    "Checks": "Prüfungen",
    "Update policy": "Aktualisierungsrichtlinie",
    "Error": "Fehler",
    "Settings": "Einstellungen",
    "Language": "Sprache",
    "System language": "Systemsprache",
    "Theme": "Design",
    "Running checks": "Prüfungen",
    "Local LLM": "Lokales LLM",
    "Source archives": "Quellarchive",
    "Backups": "Sicherungen",
    "Managed-file history": "Verlauf verwalteter Dateien",
    "Connection and compatibility test": "Verbindungs- und Kompatibilitätstest",
    "Replay a historical update": "Historisches Update wiedergeben",
    "Simulate autopilot from history": "Autopilot anhand des Verlaufs simulieren",
    "Historical autopilot simulation": "Historische Autopilot-Simulation",
    "Model tests": "Modelltests",
    "Start simulation": "Simulation starten",
    "Back": "Zurück",
    "Guarded autopilot": "Geschützter Autopilot",
    "Full autopilot · Dangerous": "Vollständiger Autopilot · Gefährlich",
    "Decision mode": "Entscheidungsmodus",
    "Continue": "Weiter",
    "Enter select": "Enter auswählen",
    "Esc back": "Esc zurück",
    "Ctrl+B settings": "Ctrl+B Einstellungen",
    "? help": "? Hilfe",
    "↑/↓ choose": "↑/↓ auswählen",
    "Drop a ZIP file into the terminal or enter its path.": "ZIP-Datei in das Terminal ziehen oder den Pfad eingeben.",
    "Changes remain in a draft until Review and save succeeds.": "Änderungen bleiben im Entwurf, bis Prüfung und Speichern erfolgreich sind.",
    "No project files, Git state, backups, source archives, or run history will be changed.": "Projektdateien, Git-Status, Sicherungen, Quellarchive und Verlauf werden nicht verändert.",
    "No historical runs available": "Keine historischen Läufe verfügbar",
    "State": "Status",
    "Policy": "Richtlinie",
    "Stage": "Phase",
    "Not configured": "Nicht konfiguriert",
    "Ready": "Bereit",
    "Exit": "Beenden",
    "Interface language": "Oberflächensprache",
    "Choose the language used by Zipflow itself. Custom JSON language packs are loaded from ~/.zipflow/languages.": "Sprache der Zipflow-Oberfläche wählen. Eigene JSON-Sprachpakete werden aus ~/.zipflow/languages geladen.",
    "Use the operating-system language when a matching pack is installed; otherwise use English.": "Sprache des Betriebssystems verwenden, wenn ein passendes Paket installiert ist; sonst Englisch.",
    "English": "Englisch",
    "Русский": "Russisch",
    "Deutsch": "Deutsch",
    "Français": "Französisch",
    "Italiano": "Italienisch",
    "Español": "Spanisch",
    "Language pack directory": "Sprachpaket-Verzeichnis",
    "Custom language packs": "Benutzerdefinierte Sprachpakete",
    "Refresh languages": "Sprachen neu laden",
    "Zipflow storage": "Zipflow-Speicher",
    "project filesystem": "Projektdateisystem",
    "Choose environment inheritance separately for checks and deployments.": "Choose environment inheritance separately for checks and deployments.",
    "Select and validate any absolute executable path. Manual overrides may deliberately use paths excluded from automatic detection.": "Select and validate any absolute executable path. Manual overrides may deliberately use paths excluded from automatic detection.",
    "Keep listed files excluded and create commit": "Keep listed files excluded and create commit",
    "Override exclusions and include all listed files": "Override exclusions and include all listed files",
    "Explicitly include every listed credential, private-data, generated, database, and large file in the first commit.": "Explicitly include every listed credential, private-data, generated, database, and large file in the first commit.",
    "First commit exclusions": "First commit exclusions",
    "Nothing is staged until you choose. You can keep these exclusions or explicitly override them and include every listed file.": "Nothing is staged until you choose. You can keep these exclusions or explicitly override them and include every listed file.",
    "Sanitized is the safe default for tests and validation. Full inheritance remains available for projects that require additional variables.": "Sanitized is the safe default for tests and validation. Full inheritance remains available for projects that require additional variables.",
    "Deployments": "Deployments",
    "Full inheritance is the practical default for deployment credentials and agent sockets. Sanitized remains available when deployment does not need them.": "Full inheritance is the practical default for deployment credentials and agent sockets. Sanitized remains available when deployment does not need them.",
    "1 project-local PATH entry was excluded from automatic detection.": "1 project-local PATH entry was excluded from automatic detection.",
    "{count} project-local PATH entries were excluded from automatic detection.": "{count} project-local PATH entries were excluded from automatic detection.",
    "Remove the manual override and search PATH while excluding executables inside the current project.": "Remove the manual override and search PATH while excluding executables inside the current project.",
    "Internal calls use resolved absolute paths. Automatic detection excludes paths inside the current project; a manual override can deliberately select one and is shown with a warning.": "Internal calls use resolved absolute paths. Automatic detection excludes paths inside the current project; a manual override can deliberately select one and is shown with a warning.",
    "Transport:": "Transport:",
    "Model instance:": "Model instance:",
    "already loaded": "already loaded",
    "median": "median",
    "chunks": "chunks",
    "Delivery:": "Delivery:",
    "batch": "batch",
    "Coverage:": "Coverage:",
    "of": "of",
    "files with content": "files with content",
    "paths in manifest": "paths in manifest",
    "Patch coverage:": "Patch coverage:",
    "files omitted": "files omitted",
    "Patch:": "Patch:",
    "tokens": "tokens",
    "Omitted:": "Omitted:",
    "files without excerpts": "files without excerpts",
    "hunks": "hunks",
    "Analysis:": "Analysis:",
    "Model response:": "Model response:",
    "Receiving a structured decision…": "Receiving a structured decision…",
    "Decision:": "Decision:",
    "Confidence:": "Confidence:",
    "Summary:": "Summary:",
    "High": "High",
    "Medium": "Medium",
    "Low": "Low",
    "full patch": "full patch",
    "representative sample": "representative sample",
    "capped batches": "capped batches",
    "changed paths only": "changed paths only",
    "file-by-file chunks": "file-by-file chunks",
    "adaptive": "adaptive",
    "Using the already loaded model instance": "Using the already loaded model instance",
    "The selected model will be loaded by the provider if needed": "The selected model will be loaded by the provider if needed",
    "Retrying with a simpler JSON response format": "Retrying with a simpler JSON response format",
    "Waiting for the model to process the patch": "Waiting for the model to process the patch",
    "Model memory was exhausted · retrying with a smaller patch": "Model memory was exhausted · retrying with a smaller patch",
    "Patch exceeded the model context · retrying with a smaller patch": "Patch exceeded the model context · retrying with a smaller patch",
    "Stream connected · waiting for prompt processing": "Stream connected · waiting for prompt processing",
    "Loading the selected model": "Loading the selected model",
    "Model loaded · preparing the prompt": "Model loaded · preparing the prompt",
    "Formatting the response internally": "Formatting the response internally",
    "Receiving the model response": "Receiving the model response",
    "The model is analyzing the patch": "The model is analyzing the patch",
    "Cancelling local LLM generation": "Cancelling local LLM generation",
    "Output limit reached · checking the generated draft": "Output limit reached · checking the generated draft",
    "Parsing the model response": "Parsing the model response",
    "Sending the patch to the local model": "Sending the patch to the local model",
    "Retrying with a smaller patch excerpt": "Retrying with a smaller patch excerpt",
    "Change delivery:": "Change delivery:",
    "Adaptive delivery uses a full patch, representative sample, or capped batches according to the model context. Ctrl+C cancels this LLM operation.": "Adaptive delivery uses a full patch, representative sample, or capped batches according to the model context. Ctrl+C cancels this LLM operation.",
    "Assessment:": "Assessment:",
    "Review:": "Review:",
    "Reasons:": "Reasons:",
    "Reviewed content:": "Reviewed content:",
    "Changed-path manifest:": "Changed-path manifest:",
    "No suitability verdict was returned; deterministic Zipflow safety checks remain active.": "No suitability verdict was returned; deterministic Zipflow safety checks remain active.",
    "The update continues without the cancelled model output.": "The update continues without the cancelled model output.",
    "The update can continue and project files have not been affected by this error.": "The update can continue and project files have not been affected by this error.",
    "No snapshot deletions to review": "Keine Snapshot-Löschungen zur Prüfung",
    "Recheck the archive as a full snapshot first.": "Prüfen Sie das Archiv zuerst erneut als vollständigen Snapshot.",
    "Recheck as patch / overlay": "Als Patch / Overlay erneut prüfen",
    "Rebuild this run without deleting local files that are absent from the ZIP": "Diesen Lauf neu erstellen, ohne lokale Dateien zu löschen, die im ZIP fehlen",
    "Recheck as full snapshot": "Als vollständigen Snapshot erneut prüfen",